{
  "id" : "undefined" ,
  "name" : "undefined" ,
  "description" : "Eloqua" ,
  "iconUrl" : "undefined" ,
  "providerName" : "undefined" ,
  "uptimeMetric" : "good" ,
  "componentImage" : {
    "url" : "undefined" ,
    "height" : "undefined" ,
    "width" : "undefined"
  } ,
  "isAvailable" : "undefined"
}